Kansas,7,230910,"DOG AND CAT FOOD, PUT UP FOR RETAIL SALE",238.85,174.37,198.07,189.68,1.917,1.4504,1.8528,1.863,-4.24
Kansas,8,410150,"WHOLE HIDES & SKINS, OF A WT >16KG BOVINE/EQU",214.56,159.32,152.46,173.7,1.7221,1.3253,1.4262,1.706,13.93
Kansas,9,20230,"MEAT OF BOVINE ANIMALS, BONELESS, FROZEN",208.41,247.53,198.23,170.65,1.6727,2.059,1.8543,1.6761,-13.91
Kansas,10,100790,"GRAIN SORGHUM, NESOI",58.11,177.32,261.97,148.17,0.4664,1.475,2.4506,1.4553,-43.44
Kansas,11,870322,"PASS MTR VEH,SPARK IGN ENG, >1000CC BUT =<150",1.07,2.04,4.31,134.38,0.0086,0.017,0.0403,1.3199,3016.41
Kansas,12,852691,RADIO NAVIGATIONAL AID APPARATUS,163.33,158.26,135.46,129.53,1.3109,1.3164,1.2672,1.2723,-4.38
Kansas,13,760612,"ALUMINUM ALLOY RECT PLATES ETC, OVER .2 MM TH",75.18,97.37,107.72,113.29,0.6034,0.8099,1.0077,1.1127,5.17
Kansas,14,284210,DOUBLE OR COMPLEX SILICATES,70.77,62.54,100,89.25,0.568,0.5202,0.9354,0.8766,-10.75
Kansas,15,410411,"BOV/EQ HIDE/SKIN,FUL GRN,UNSPLIT;GRN SPL, WET",105.5,121.6,110.4,82.02,0.8467,1.0115,1.0327,0.8056,-25.7
Kansas,16,300230,VACCINES FOR VETRINARY MEDICINE,51.14,59.13,82.18,80.73,0.4104,0.4918,0.7688,0.7929,-1.77
Kansas,17,842951,"MECH FRONT-END SHOVEL LOADERS, SELF-PROPELLED",132.21,114.65,103.01,79.9,1.0612,0.9537,0.9636,0.7847,-22.44
Kansas,18,20220,"MEAT, BOVINE CUTS WITH BONE IN, FROZEN",78.99,112.08,80.2,79.44,0.634,0.9323,0.7502,0.7802,-0.95
Kansas,19,401194,"NEW PNUMAT RUB TIRE, CONST/INDUST VEH/MAC,RIM",158.83,101.12,96.49,79.09,1.2748,0.8411,0.9026,0.7768,-18.03
Kansas,20,903180,"MEAS & CHECKNG INSTRUMENT, APPLIANCES & MACH",79.71,107.51,108.05,77.21,0.6398,0.8943,1.0107,0.7584,-28.54
Kansas,21,20329,"MEAT OF SWINE, NESOI, FROZEN",96.47,122.86,73.92,67.05,0.7742,1.0219,0.6914,0.6585,-9.29
Kansas,22,20610,"OFFAL OF BOVINE ANIMALS, EDIBLE, FRESH OR CHI",32.7,34.32,41.72,65.18,0.2625,0.2855,0.3902,0.6402,56.25
Kansas,23,150210,"TALLOW OF BOVINE ANIMALS, SHEEP OR GOATS, NES",92.13,76.25,58.91,63.35,0.7394,0.6342,0.5511,0.6222,7.53
Kansas,24,230400,"SOYBEAN OILCAKE & OTH SOLID RESIDUE, WH/NOT G",39.13,18.86,19.55,58.53,0.3141,0.1568,0.1829,0.5749,199.41
Kansas,25,843340,"STRAW OR FODDER BALERS, INCLUDING PICK-UP BAL",19.78,29.31,36.54,56.85,0.1588,0.2438,0.3418,0.5584,55.59
Kentucky,0,0,World,25411.72,27757.39,27643.94,29199.16,1.6098,1.7114,1.8391,2.0123,5.63
Kentucky,0,25,Top 25,14051.81,16258.96,16717.02,19278.42,55.2966,58.5753,60.4727,66.0239,15.32
Kentucky,1,880000,"CIVILIAN AIRCRAFT, ENGINES, AND PARTS",5624.6,7738.34,8676.74,10800.48,22.1339,27.8785,31.3875,36.989,24.48
Kentucky,2,870323,PASS VEH SPK-IG INT COM RCPR P ENG >1500 NOV,1593.55,1685.32,1465.93,1326.81,6.2709,6.0716,5.3029,4.544,-9.49
Kentucky,3,300210,"ANTISERA, BLOOD FRACTIONS & IMMUNOLOGICAL PRO",866.94,678.28,1018.07,1228.58,3.4116,2.4436,3.6828,4.2076,20.68
Kentucky,4,870324,PASS VEH SPK-IG INT COM RCPR P ENG > 3000 CC,1198.67,1383.86,1049.74,890.15,4.717,4.9856,3.7974,3.0485,-15.2
Kentucky,5,870422,MTR VEH TRANS GDS COM-IG INT C P E GVW >5NOV2,580.75,290.07,334.18,491.67,2.2854,1.045,1.2089,1.6838,47.13
Kentucky,6,870894,"STEERING WHEELS, COLUMNS & BOXES F MOTOR VEHI",181.07,243.01,360.2,412.67,0.7126,0.8755,1.303,1.4133,14.57
Kentucky,7,700490,DRWN/BLWN GLSS SHTS W/WO ABSRB/RFCT LYR N OTH,421.12,338.62,326.81,363.84,1.6572,1.2199,1.1822,1.2461,11.33
Kentucky,8,382200,"COMPOSITE DIAGNOSTIC/LAB REAGENTS, EXC PHARMA",177.85,265.49,264.88,322.76,0.6999,0.9565,0.9582,1.1054,21.85
Kentucky,9,220830,WHISKIES,300.23,301.33,310.76,294.71,1.1815,1.0856,1.1242,1.0093,-5.16
Kentucky,10,391000,"SILICONES, IN PRIMARY FORMS",413.28,348.61,314.65,271.24,1.6263,1.2559,1.1382,0.9289,-13.8
Kentucky,11,870899,"PARTS AND ACCESSORIES OF MOTOR VEHICLES, NESO",248.8,285.8,268.48,260.01,0.9791,1.0296,0.9712,0.8905,-3.15
Kentucky,12,870829,"PTS & ACCESS OF BODIES OF MOTOR VEHICLES, NES",263.74,257.02,212.91,253.18,1.0379,0.926,0.7702,0.8671,18.92
Kentucky,13,902190,OTH ARTIFICAL PTS OF THE BODY & PTS & ACCESSO,188.4,201.48,211.39,229.88,0.7414,0.7259,0.7647,0.7873,8.75
Kentucky,14,870432,"MTR VEH TRANS GDS SPK-IG IN C P ENG, GVW > 5",152.13,65.8,102.3,210.93,0.5987,0.2371,0.37,0.7224,106.2
Kentucky,15,870421,"TRUCKS, NESOI, DIESEL ENG, GVW 5 METRIC TONS",143.49,382,209.94,209.75,0.5647,1.3762,0.7594,0.7183,-0.09
Kentucky,16,851762,MACH FOR RECP/CONVR/TRANS/REGN OF VOICE/IMAGE,258.21,285.93,250.1,207.91,1.0161,1.0301,0.9047,0.712,-16.87
Kentucky,17,841199,GAS TURBINE PARTS NESOI,99.45,80.99,112.54,206.91,0.3914,0.2918,0.4071,0.7086,83.86
Kentucky,18,10121,"HORSES, LIVE, PUREBRED BREEDING",161.4,175.13,146.69,195.13,0.6351,0.6309,0.5307,0.6683,33.02
Kentucky,19,870830,BRAKES AND SERVO-BREAKS; PARTS THEREOF,182.56,180.33,174.12,193.97,0.7184,0.6497,0.6299,0.6643,11.4
Kentucky,20,870431,"MTR VEH TRANS GDS SPK IG IN C P ENG, GVW NOV",262.28,366.16,259.83,193.48,1.0321,1.3191,0.9399,0.6626,-25.54
Kentucky,21,901819,"ELECTRO-DIAGNOSTIC APPARATUS NESOI, AND PARTS",119.36,133.18,156.5,167.66,0.4697,0.4798,0.5661,0.5742,7.13
Kentucky,22,940190,"PARTS OF SEATS (EX MEDICAL, BARBER, DENTAL ET",250.17,198.89,179.71,141.43,0.9845,0.7165,0.6501,0.4843,-21.3
Kentucky,23,760612,"ALUMINUM ALLOY RECT PLATES ETC, OVER .2 MM TH",125.84,133.25,87.95,140.58,0.4952,0.4801,0.3182,0.4814,59.83
Kentucky,24,870880,SUSPENSION SHOCK ABSORBERS FOR MOTOR VEHICLES,131.72,124.91,124.23,133.98,0.5183,0.45,0.4494,0.4588,7.84
Kentucky,25,400220,BUTADIENE RUBBER (BR),106.21,115.17,98.39,130.75,0.418,0.4149,0.3559,0.4478,32.89
Louisiana,0,0,World,63247.02,64770.1,48685.89,48418.79,4.0067,3.9935,3.239,3.3369,-0.55
Louisiana,0,25,Top 25,48255.78,49907.84,36838.37,38171.22,76.2973,77.0538,75.6654,78.8356,3.62
Louisiana,1,120190,"SOYBEANS, NESOI",9511.06,10670.34,8993.65,10930.4,15.038,16.4742,18.4728,22.5747,21.53
Louisiana,2,271019,PETROL OIL BITUM MINERAL (NT CRUD) ETC NT BIO,21143.87,20288.66,12027.43,10242.62,33.4306,31.3241,24.7041,21.1542,-14.84
Louisiana,3,100590,"CORN (MAIZE), OTHER THAN SEED CORN",3283.38,5404.08,4020.54,4494.05,5.1914,8.3435,8.2581,9.2816,11.78
Louisiana,4,271012,"LT OILS, PREPS GT=70% PETROLEUM/BITUM NT BIOD",3167.74,3911.08,2177.91,2490.95,5.0085,6.0384,4.4734,5.1446,14.37
Louisiana,5,230400,"SOYBEAN OILCAKE & OTH SOLID RESIDUE, WH/NOT G",1999.35,1941.24,1927.11,1665.63,3.1612,2.9971,3.9582,3.44,-13.57
Louisiana,6,270900,CRUDE OIL FROM PETROLEUM AND BITUMINOUS MINER,323.67,397.53,785.22,989.16,0.5118,0.6137,1.6128,2.0429,25.97
Louisiana,7,271111,"NATURAL GAS, LIQUEFIED",0,0.01,0,942.17,0,0,0,1.9459,0
Louisiana,8,390410,"POLYVINYL CHLORIDE, NOT MIXED WITH OTHER SUBS",691.84,756.83,597.78,676.9,1.0939,1.1685,1.2278,1.398,13.23
Louisiana,9,293190,"ORGANO-INORGANIC COMPOUNDS, NESOI",547.25,676.75,664.71,487.23,0.8653,1.0449,1.3653,1.0063,-26.7
Louisiana,10,100610,RICE IN THE HUSK (PADDY OR ROUGH),462.17,437.43,419.2,443.87,0.7307,0.6754,0.861,0.9167,5.89
Louisiana,11,880000,"CIVILIAN AIRCRAFT, ENGINES, AND PARTS",303.63,559.21,301.44,443.14,0.4801,0.8634,0.6191,0.9152,47.01
Louisiana,12,230330,"BREWING OR DISTILLING DREGS AND WASTE, W/NT P",537.53,695.91,816.24,422.62,0.8499,1.0744,1.6765,0.8728,-48.22
Louisiana,13,100199,"WHEAT AND MESLIN, NESOI",2090.48,819,615.84,412.85,3.3053,1.2645,1.2649,0.8527,-32.96
Louisiana,14,150710,"SOYBEAN OIL & FRACTIONS, CRUDE, WHETH/NOT DEG",477.43,392.85,394.75,388.92,0.7549,0.6065,0.8108,0.8032,-1.48
Louisiana,15,400270,ETHYLENE-PROPYLENE-NONCONJUGATED DIENE RUBBER,486.06,479.55,429.42,383.86,0.7685,0.7404,0.882,0.7928,-10.61
Louisiana,16,390190,"POLYMERS OF ETHYLENE NESOI, IN PRIMARY FORMS",393.32,341.1,388.96,346.22,0.6219,0.5266,0.7989,0.7151,-10.99
Louisiana,17,271311,"PETROLEUM COKE, NOT CALCINED",472.36,483.13,340.7,344.74,0.7469,0.7459,0.6998,0.712,1.19
Louisiana,18,220710,"ETHYL ALCOHOL, UNDENAT, ALCHOL NOT UN 80% BY",7.01,83.83,134.99,328.6,0.0111,0.1294,0.2773,0.6787,143.43
Louisiana,19,290250,STYRENE,624.64,219.29,309.24,313.18,0.9876,0.3386,0.6352,0.6468,1.28
Louisiana,20,270799,OILS & PRODUCTS NESOI AS COAL TAR DISTILLATES,417.56,293.39,274.33,254.27,0.6602,0.453,0.5635,0.5252,-7.31
Louisiana,21,100630,"RICE, SEMI- OR WHOLLY MILLED, POLISHED ETC OR",417,366.93,382.65,252.42,0.6593,0.5665,0.7859,0.5213,-34.03
Louisiana,22,281512,SODIUM HYDROXIDE IN AQUEOUS SOLUTION,191,167.54,189.25,242.64,0.302,0.2587,0.3887,0.5011,28.21
Louisiana,23,151521,"CORN (MAIZE) OIL, CRUDE, NOT CHEMICALLY MODIF",250.51,181.82,210.41,230.77,0.3961,0.2807,0.4322,0.4766,9.68
Louisiana,24,290511,METHANOL (METHYL ALCOHOL),2.13,2.67,108.51,228.81,0.0034,0.0041,0.2229,0.4726,110.86
Louisiana,25,271312,"PETROLEUM COKE, CALCINED",454.8,337.68,328.13,215.19,0.7191,0.5213,0.674,0.4444,-34.42
Massachusetts,0,0,World,26812.02,27384.17,25290.12,25891.74,1.6986,1.6884,1.6825,1.7844,2.38
Massachusetts,0,25,Top 25,11533.5,12019.07,10949.43,12248.85,43.0162,43.8906,43.2953,47.3079,11.87
Massachusetts,1,711291,WASTE & SCRAP GOLD EXCL SWPNGS CNTNG OTH PREC,22.75,170.54,661.6,1513.68,0.0848,0.6228,2.6161,5.8462,128.79
Massachusetts,2,901890,"INSTR & APPL F MEDICAL SURGICAL DENTAL VET, N",1031.04,1053.41,1053.84,1100.73,3.8454,3.8468,4.167,4.2513,4.45
Massachusetts,3,901839,"MED NEEDLES. NESOI, CATHERERS ETC AND PARTS E",887.39,974.66,997.39,1015.46,3.3097,3.5592,3.9438,3.9219,1.81
Massachusetts,4,848620,MACHINES FOR MAN. SEMICONDUTOR DEVICES/ELEC I,718.95,720.73,1030.21,929.02,2.6814,2.6319,4.0736,3.5881,-9.82
Massachusetts,5,854231,"PROCESSORS AND CONTROLLERS, ELECTRONIC INTEG",571.34,935.07,892.02,859.84,2.1309,3.4146,3.5271,3.3209,-3.61
Massachusetts,6,710812,"GOLD, NONMONETARY, UNWROUGHT NESOI",2407.97,1941.95,181.66,596.05,8.9809,7.0915,0.7183,2.3021,228.11
Massachusetts,7,300210,"ANTISERA, BLOOD FRACTIONS & IMMUNOLOGICAL PRO",369.34,366.63,508.44,583.01,1.3775,1.3388,2.0104,2.2517,14.67
Massachusetts,8,880000,"CIVILIAN AIRCRAFT, ENGINES, AND PARTS",580.67,714.67,699.36,566.8,2.1657,2.6098,2.7654,2.1891,-18.95
Massachusetts,9,300390,"MEDICAMENTS NESOI, NOT IN DOSAGE FORM ETC",283.24,454.14,511.35,566.21,1.0564,1.6584,2.0219,2.1869,10.73
Massachusetts,10,902780,PHY CHEM INS/APPR;MEAS VSCSTY & HEAT NESOI,348.9,393.3,386.38,388.59,1.3013,1.4362,1.5278,1.5008,0.57
Massachusetts,11,854239,"ELECTRONIC INTEGRATED CIRCUITS, NESOI",380.78,488.51,445.28,388.24,1.4202,1.7839,1.7607,1.4995,-12.81
Massachusetts,12,382200,"COMPOSITE DIAGNOSTIC/LAB REAGENTS, EXC PHARMA",347.94,344.88,341.7,364.17,1.2977,1.2594,1.3511,1.4065,6.57
Massachusetts,13,847170,"AUTOMATIC DATA PROCESSING STORAGE UNITS, N.E.",331.43,284.54,240.85,342.19,1.2361,1.0391,0.9523,1.3216,42.08
Massachusetts,14,901819,"ELECTRO-DIAGNOSTIC APPARATUS NESOI, AND PARTS",427.88,419.88,346.94,337.31,1.5958,1.5333,1.3719,1.3028,-2.78
Massachusetts,15,842129,FILTER/PURIFY MACHINE & APPARATUS FOR LIQUID,166.48,210.44,285.04,333.44,0.6209,0.7685,1.1271,1.2878,16.98
Massachusetts,16,300490,"MEDICAMENTS NESOI, MEASURED DOSES, RETAIL PK",509.59,341.48,222.59,314.03,1.9006,1.247,0.8802,1.2129,41.08
Massachusetts,17,851762,MACH FOR RECP/CONVR/TRANS/REGN OF VOICE/IMAGE,390,548.69,487.49,307.32,1.4546,2.0037,1.9276,1.187,-36.96
Massachusetts,18,848690,"PARTS & ACCSESORIES FOR MACH TO MAN. SEMICNT,",314.1,275.96,256.59,297.19,1.1715,1.0077,1.0146,1.1478,15.82
Massachusetts,19,841191,TURBOJET AND TURBOPROLLER PARTS,229.78,237.6,295.49,256.67,0.857,0.8676,1.1684,0.9913,-13.14
Massachusetts,20,902139,ARTIFICIAL JOINTS & PARTS & ACCESSORIES THERO,293.68,237.59,224.13,222.06,1.0953,0.8676,0.8862,0.8577,-0.92
Massachusetts,21,850440,STATIC CONVERTERS; ADP POWER SUPPLIES,213.51,218.51,208.69,218.37,0.7963,0.7979,0.8252,0.8434,4.64
Massachusetts,22,30622,"LOBSTERS, LIVE, FRESH,CH, DRIED, SALTD OR IN",179.92,191.17,190.39,203.62,0.671,0.6981,0.7528,0.7864,6.95
Massachusetts,23,902790,"PTS OF INST, PHYS/CHEM ANALYSIS ETC, NESOI",203.58,199.57,194.24,195.2,0.7593,0.7288,0.768,0.7539,0.5
Massachusetts,24,847989,MACH & MECHANICAL APPL W INDIVIDUAL FUNCTION,100.17,93.77,123.82,175.77,0.3736,0.3424,0.4896,0.6789,41.95
Massachusetts,25,842199,FILTER/PURIFY MACHINE & APPARATUS PARTS,223.06,201.38,163.93,173.87,0.832,0.7354,0.6482,0.6715,6.07
Maryland,0,0,World,11746.72,12228.28,10051.8,9658.23,0.7442,0.754,0.6687,0.6656,-3.92
Maryland,0,25,Top 25,5471.14,5964.24,4388.53,4418.41,46.5759,48.7742,43.6592,45.7476,0.68
Maryland,1,880212,HELICOPTERS OF AN UNLADEN WEIGHT EXCEEDING 20,0,189,81.01,438.43,0,1.5456,0.8059,4.5394,441.21
Maryland,2,382200,"COMPOSITE DIAGNOSTIC/LAB REAGENTS, EXC PHARMA",295.24,295.53,337.05,399.44,2.5134,2.4168,3.3532,4.1358,18.51
Maryland,3,880000,"CIVILIAN AIRCRAFT, ENGINES, AND PARTS",261.78,454.4,310.42,340.08,2.2285,3.716,3.0882,3.5212,9.55
Maryland,4,880330,"PARTS OF AIRPLANES OR HELICOPTERS, NESOI",176.53,129.23,273.61,307.56,1.5028,1.0568,2.722,3.1845,12.41
Maryland,5,870324,PASS VEH SPK-IG INT COM RCPR P ENG > 3000 CC,1516.95,1539.65,809.5,302.28,12.9138,12.5909,8.0533,3.1297,-62.66
Maryland,6,381519,"SUPPORTED CATALYSTS, NESOI",255.82,276.98,323.79,275.51,2.1778,2.2651,3.2212,2.8526,-14.91
Maryland,7,300210,"ANTISERA, BLOOD FRACTIONS & IMMUNOLOGICAL PRO",79.14,293.62,268.08,260.89,0.6737,2.4012,2.667,2.7012,-2.68
Maryland,8,852610,RADAR APPARATUS,60.32,38.96,162.12,247.9,0.5135,0.3186,1.6128,2.5667,52.91
Maryland,9,851762,MACH FOR RECP/CONVR/TRANS/REGN OF VOICE/IMAGE,600.87,610.52,357.92,190.71,5.1152,4.9927,3.5607,1.9745,-46.72
Maryland,10,711311,"JEWELRY AND PARTS THEREOF, OF SILVER",97.26,126.75,136.68,175.62,0.828,1.0366,1.3598,1.8183,28.48
Maryland,11,852560,"TRANSMISSION APP INCORP RECEPTION, FOR RADIO",36.26,51.11,68.99,170.92,0.3087,0.4179,0.6863,1.7697,147.75
Maryland,12,300490,"MEDICAMENTS NESOI, MEASURED DOSES, RETAIL PK",422.67,441.48,292.35,170.01,3.5982,3.6103,2.9084,1.7603,-41.85
Maryland,13,490199,"PRINTED BOOKS, BROCHURES, ETC., NESOI",162.7,149.4,153.92,138.39,1.385,1.2217,1.5312,1.4329,-10.09
Maryland,14,270112,"BITUMINOUS COAL, NOT AGGLOMERATED",72.68,11.99,25.59,137.71,0.6187,0.098,0.2546,1.4258,438.13
Maryland,15,870323,PASS VEH SPK-IG INT COM RCPR P ENG >1500 NOV,722.7,655.03,215.46,135.66,6.1523,5.3567,2.1435,1.4046,-37.04
Maryland,16,902750,INSTRUMENTS ETC USING OPTICAL RADIATIONS NESO,47.22,78.99,112.99,99.43,0.402,0.646,1.124,1.0295,-12
Maryland,17,382100,PREPARED CULTURE MEDIA FOR DEVEL OF MICROORGA,127.59,126.73,110.48,91.35,1.0862,1.0364,1.0991,0.9459,-17.31
Maryland,18,870190,"TRACTORS, NESOI",114.6,102.51,52.46,76.31,0.9756,0.8383,0.5219,0.7901,45.45
Maryland,19,720449,FERROUS WASTE & SCRAP NESOI,124.19,96.6,51.66,72.79,1.0572,0.79,0.5139,0.7536,40.9
Maryland,20,870590,"SPECIAL PURPOSE VEHICLES, NESOI",10.44,7.6,1.77,72.11,0.0888,0.0621,0.0176,0.7466,3982.18
Maryland,21,901890,"INSTR & APPL F MEDICAL SURGICAL DENTAL VET, N",131.07,93.11,70.17,68.02,1.1158,0.7614,0.6981,0.7043,-3.06
Maryland,22,392690,"ARTICLES OF PLASTICS, NESOI",37.35,44.11,54.43,66.41,0.3179,0.3607,0.5415,0.6876,22
Maryland,23,711319,"JEWELRY AND PARTS THEREOF, OF OTH PRECIOUS ME",42.37,59.51,62.87,62.13,0.3607,0.4866,0.6254,0.6433,-1.17
Maryland,24,381590,"REACTION INITIATORS & ACCELERATORS, ETC, NESO",32.67,33.89,26.4,60.47,0.2781,0.2772,0.2626,0.6261,129.08
Maryland,25,930690,BOMB MINES OT AMMNTION PROJCTIONS ETC AND PAR,42.76,57.55,28.82,58.29,0.364,0.4706,0.2868,0.6035,102.23
Maine,0,0,World,2686.76,2811.06,2762.99,2875.27,0.1702,0.1733,0.1838,0.1982,4.06
Maine,0,25,Top 25,1623.92,1734.75,1835.51,1980.45,60.4417,61.7118,66.4319,68.8788,7.9
Maine,1,30622,"LOBSTERS, LIVE, FRESH,CH, DRIED, SALTD OR IN",243.25,349,331.41,381.6,9.0537,12.4151,11.9945,13.2719,15.15
Maine,2,880000,"CIVILIAN AIRCRAFT, ENGINES, AND PARTS",152.19,111.66,266.96,315.32,5.6643,3.9722,9.6619,10.9664,18.11
Maine,3,854239,"ELECTRONIC INTEGRATED CIRCUITS, NESOI",47.27,154.9,229.49,182.18,1.7593,5.5103,8.306,6.336,-20.62
Maine,4,271121,"NATURAL GAS, GASEOUS",133.86,216.6,92.4,157.09,4.9824,7.7053,3.3441,5.4633,70.01
Maine,5,481013,"PPR/PBRD FOR WRIT/PRING,CLAY CTD,<=10%MEC FBR",175.1,160.59,120.03,116.75,6.517,5.7129,4.3443,4.0605,-2.73
Maine,6,470329,"CHEM WOODPULP, SODA ETC, N DIS S BL & BL NONC",191.72,99.55,133.7,110.83,7.1357,3.5412,4.8388,3.8546,-17.1
Maine,7,440320,"CONIFEROUS WOOD IN THE ROUGH, NOT TREATED",159.07,145.32,157.39,94.57,5.9206,5.1696,5.6965,3.2891,-39.91
Maine,8,30214,ATLANTIC SALMON AND DANUBE SALMON FRESH OR CH,48.82,36.06,19.33,72.71,1.8169,1.283,0.6995,2.5288,276.21
Maine,9,481151,"PPR/PBRD,CTD/IMPG/CVR W/PLAST,BLEACH,WT>150G/",46.99,42.98,38.75,63.99,1.7491,1.5288,1.4025,2.2254,65.12
Maine,10,130239,"MUCILAGE & THICKNER W/N MODIFIED,FRM VEG PRD",2.4,2.37,7.24,54.47,0.0892,0.0843,0.2621,1.8946,652.28
Maine,11,30441,"PACIFIC, ATLANTIC, DANUBE SALMON FILLET FRESH",31.11,18.76,45.98,52.79,1.1579,0.6672,1.6642,1.836,14.81
Maine,12,382200,"COMPOSITE DIAGNOSTIC/LAB REAGENTS, EXC PHARMA",48.63,51.78,50.04,42.44,1.81,1.8422,1.811,1.4759,-15.19
Maine,13,902750,INSTRUMENTS ETC USING OPTICAL RADIATIONS NESO,39.58,46.3,37.18,35.88,1.4733,1.6472,1.3458,1.2478,-3.51
Maine,14,160232,"PREPARED OR PRESERVED CHICKEN MEAT OR OFFAL,",25.91,27.2,25.82,32.23,0.9642,0.9677,0.9345,1.1211,24.84
Maine,15,440399,"NONCONIFEROUS WOOD IN THE ROUGH NESOI, NOT TR",24.67,32.55,33.36,31.4,0.9182,1.158,1.2075,1.092,-5.88
Maine,16,930591,PARTS & ACCESSOR. OF MILITARY WEAPONS OF HEAD,19.17,14.38,36.35,28.35,0.7133,0.5116,1.3155,0.9861,-21.99
Maine,17,300230,VACCINES FOR VETRINARY MEDICINE,16.57,18.41,19.63,27.72,0.6167,0.6549,0.7104,0.9642,41.25
Maine,18,854231,"PROCESSORS AND CONTROLLERS, ELECTRONIC INTEG",45.79,30.91,23.68,25.49,1.7042,1.0995,0.8571,0.8867,7.66
Maine,19,440710,"CONIFEROUS WOOD SAWN, SLICED ETC, OVER 6 MM T",28.64,27.99,27.51,25.09,1.0661,0.9957,0.9955,0.8726,-8.79
Maine,20,30821,"SEA URCHINS, LIVE, FRESH OR CHILLED",24.61,23.6,21.12,23.98,0.9159,0.8395,0.7645,0.834,13.53
Maine,21,481190,"PAPER, PAPERBD, CELLULOSE WADD ETC, COAT ETC",63.02,56.9,61.39,23.62,2.3456,2.0243,2.2219,0.8213,-61.53
Maine,22,841199,GAS TURBINE PARTS NESOI,12.08,10.06,12.29,22.61,0.4497,0.3578,0.4447,0.7863,84
Maine,23,81190,"FRUIT NESOI & NUTS, SWEETENED ETC OR NOT, FRO",20.55,27.31,17.14,20.14,0.765,0.9715,0.6204,0.7006,17.51
Maine,24,81040,"CRANBERRIES, BLUEBERRIES, ETC, FRESH",22.84,19.98,11.75,20.07,0.85,0.7107,0.4252,0.6979,70.82
Maine,25,720429,"ALLOY STEEL WASTE AND SCRAP, NOT STAINLESS",0.09,9.6,15.57,19.14,0.0032,0.3414,0.5636,0.6656,22.9
Michigan,0,0,World,59399.81,57573.11,53954.03,54713.48,3.763,3.5498,3.5895,3.7707,1.41
Michigan,0,25,Top 25,31565.5,29541.93,27603.5,28739.67,53.1407,51.312,51.1611,52.5276,4.12
Michigan,1,870431,"MTR VEH TRANS GDS SPK IG IN C P ENG, GVW NOV",4554.51,3872.75,3989.8,4698.68,7.6675,6.7267,7.3948,8.5878,17.77
Michigan,2,870324,PASS VEH SPK-IG INT COM RCPR P ENG > 3000 CC,4385.73,3641,3079.4,3515.71,7.3834,6.3241,5.7074,6.4257,14.17
Michigan,3,870829,"PTS & ACCESS OF BODIES OF MOTOR VEHICLES, NES",3720.59,3475.59,3077.45,3318.49,6.2636,6.0368,5.7038,6.0652,7.83
Michigan,4,870840,GEAR BOXES FOR MOTOR VEHICLES,2209.85,1874.25,2273.23,2274.76,3.7203,3.2554,4.2133,4.1576,0.07
Michigan,5,870899,"PARTS AND ACCESSORIES OF MOTOR VEHICLES, NESO",2264.21,2393.12,2250.27,2248.86,3.8118,4.1567,4.1707,4.1102,-0.06
Michigan,6,870323,PASS VEH SPK-IG INT COM RCPR P ENG >1500 NOV,2706.27,1693.38,1198.09,1188.89,4.556,2.9413,2.2206,2.1729,-0.77
Michigan,7,840734,SPARK-IGNTN RECPRCTING PISTON ENGINE ETC > 10,1130.44,1198.24,1040.2,1187.93,1.9031,2.0812,1.9279,2.1712,14.2
Michigan,8,700910,REAR-VIEW MIRRORS FOR VEHICLES,756.84,856.77,943.49,994.67,1.2742,1.4881,1.7487,1.818,5.42
Michigan,9,280461,SILICON CONTAIN BY WT NT < 99.99% OF SILICON,497.55,716.08,549.04,873.79,0.8376,1.2438,1.0176,1.597,59.15
Michigan,10,870850,DRIVE AXLES WITH DIFFERENTIAL FOR MOTOR VEHIC,583.64,752.34,904.34,867.31,0.9826,1.3068,1.6761,1.5852,-4.09
Michigan,11,840991,SPARK-IGNITION INT COMBUSTION PISTON ENG PTS,709.87,875.1,833.62,817.14,1.1951,1.52,1.5451,1.4935,-1.98
Michigan,12,271121,"NATURAL GAS, GASEOUS",1931.51,2053.61,1233.68,727.56,3.2517,3.567,2.2865,1.3298,-41.03
Michigan,13,880000,"CIVILIAN AIRCRAFT, ENGINES, AND PARTS",892.85,765.96,669.39,725.07,1.5031,1.3304,1.2407,1.3252,8.32
Michigan,14,870894,"STEERING WHEELS, COLUMNS & BOXES F MOTOR VEHI",541.09,595.39,751.39,615.02,0.9109,1.0341,1.3927,1.1241,-18.15
Michigan,15,940190,"PARTS OF SEATS (EX MEDICAL, BARBER, DENTAL ET",442.82,481.95,466.02,559.97,0.7455,0.8371,0.8637,1.0235,20.16
Michigan,16,870421,"TRUCKS, NESOI, DIESEL ENG, GVW 5 METRIC TONS",260.43,547.97,671.94,558.76,0.4384,0.9518,1.2454,1.0213,-16.84
Michigan,17,870880,SUSPENSION SHOCK ABSORBERS FOR MOTOR VEHICLES,698.88,610.81,575.75,552.18,1.1766,1.0609,1.0671,1.0092,-4.09
Michigan,18,870333,PASS VEH COM-IG INT COM ENG > 2500 CC,1048.73,969.46,871.3,533.48,1.7656,1.6839,1.6149,0.975,-38.77
Michigan,19,731815,THREADED SCREWS AND BOLTS NESOI OF IRON OR ST,289.93,310.75,343.95,438.66,0.4881,0.5397,0.6375,0.8017,27.54
Michigan,20,850760,LITHIUM ION BATTERIES,317.24,258.82,249.89,378.18,0.5341,0.4495,0.4631,0.6912,51.34
Michigan,21,851220,ELECT LIGHTING/VISUAL SIGNLNG EQ EX FOR BICYC,303.88,271.44,324.12,361.67,0.5116,0.4715,0.6007,0.661,11.58
Michigan,22,391000,"SILICONES, IN PRIMARY FORMS",262,276.68,243.86,331.95,0.4411,0.4806,0.452,0.6067,36.12
Michigan,23,870870,ROAD WHEELS & PTS & ACCESSORIES FOR MOTOR VEH,447.77,423,413.98,326.51,0.7538,0.7347,0.7673,0.5968,-21.13
Michigan,24,392690,"ARTICLES OF PLASTICS, NESOI",317.21,327.47,291.19,322.35,0.534,0.5688,0.5397,0.5892,10.7
Michigan,25,853710,CONTROLS ETC W ELECT APPR F ELECT CONT NOV 10,291.66,300,358.12,322.07,0.491,0.5211,0.6638,0.5886,-10.07
Minnesota,0,0,World,20760.14,21397.6,20016.17,19202.45,1.3152,1.3193,1.3317,1.3234,-4.07
Minnesota,0,25,Top 25,5961.64,6627.3,6171.58,5926.5,28.7167,30.9722,30.8329,30.8632,-3.97
Minnesota,1,901839,"MED NEEDLES. NESOI, CATHERERS ETC AND PARTS E",772.96,875,863.87,810.28,3.7233,4.0893,4.3159,4.2197,-6.2
Minnesota,2,880000,"CIVILIAN AIRCRAFT, ENGINES, AND PARTS",600.05,518.42,452.97,489.21,2.8904,2.4228,2.263,2.5477,8
Minnesota,3,842199,FILTER/PURIFY MACHINE & APPARATUS PARTS,340.71,370.94,412.35,334.04,1.6412,1.7336,2.0601,1.7396,-18.99
Minnesota,4,854290,ELECTRONIC INTEGRATED CIRCUITS AND MCRSSMBLS,388.32,430.86,347.86,331.5,1.8705,2.0136,1.7379,1.7263,-4.7
Minnesota,5,851762,MACH FOR RECP/CONVR/TRANS/REGN OF VOICE/IMAGE,341.97,322.07,332.27,297.66,1.6473,1.5052,1.66,1.5501,-10.42
Minnesota,6,391990,"PLATES, SHEETS, FILM ETC, PLASTICS, SELF-ADH",289.77,294.55,297.72,293.74,1.3958,1.3765,1.4874,1.5297,-1.34
Minnesota,7,902190,OTH ARTIFICAL PTS OF THE BODY & PTS & ACCESSO,344.35,308.12,297.33,291.89,1.6587,1.44,1.4854,1.5201,-1.83
Minnesota,8,901890,"INSTR & APPL F MEDICAL SURGICAL DENTAL VET, N",203.69,232.1,251.2,268.52,0.9812,1.0847,1.255,1.3984,6.9
Minnesota,9,870310,PASS VEH FOR SNOW; GOLF CARTS & SIMILAR VEHIC,382.2,359.41,269.28,217.31,1.841,1.6797,1.3453,1.1317,-19.3
Minnesota,10,900190,LENSES PRISMS MIRRORS OPTCL ELMNT N OPTICALLY,133.48,255.97,278.32,207.5,0.6429,1.1963,1.3905,1.0806,-25.44
Minnesota,11,870321,"PASS MTR VEH, SPARK IGN ENG, NOT OV 1,000 CC",366.8,418.06,316.42,206.29,1.7669,1.9538,1.5808,1.0743,-34.8
Minnesota,12,120190,"SOYBEANS, NESOI",141.26,227.45,174.4,188.61,0.6805,1.063,0.8713,0.9822,8.15
Minnesota,13,901819,"ELECTRO-DIAGNOSTIC APPARATUS NESOI, AND PARTS",109.98,133.95,170.93,187.05,0.5298,0.626,0.854,0.9741,9.43
Minnesota,14,470200,"CHEMICAL WOODPULP, DISSOLVING GRADES",137.3,287.1,181.71,186.89,0.6614,1.3417,0.9078,0.9733,2.85
Minnesota,15,100590,"CORN (MAIZE), OTHER THAN SEED CORN",112.11,195.56,126.47,169.82,0.54,0.914,0.6318,0.8844,34.28
Minnesota,16,870899,"PARTS AND ACCESSORIES OF MOTOR VEHICLES, NESO",69.9,96.58,80.13,166.46,0.3367,0.4513,0.4003,0.8668,107.72
Minnesota,17,392690,"ARTICLES OF PLASTICS, NESOI",106.63,130.14,139.76,158.53,0.5136,0.6082,0.6982,0.8256,13.43
Minnesota,18,230400,"SOYBEAN OILCAKE & OTH SOLID RESIDUE, WH/NOT G",209.81,137.09,178.31,147.19,1.0106,0.6407,0.8908,0.7665,-17.45
Minnesota,19,847989,MACH & MECHANICAL APPL W INDIVIDUAL FUNCTION,140.77,165.48,144.76,146.66,0.6781,0.7733,0.7232,0.7638,1.31
Minnesota,20,902620,"INST & APPRTS, MEASURING/CHECKING PRESSURE",171.78,174.41,170.32,142.26,0.8274,0.8151,0.8509,0.7409,-16.47
Minnesota,21,230990,"ANIMAL FEED PREP EXCEPT DOG OR CAT FOOD, RETA",82.25,100.85,128.44,142.17,0.3962,0.4713,0.6417,0.7403,10.69
Minnesota,22,900120,SHEETS AND PLATES OF POLARIZING MATERIAL,83.39,110.67,125.32,139.05,0.4017,0.5172,0.6261,0.7241,10.96
Minnesota,23,902750,INSTRUMENTS ETC USING OPTICAL RADIATIONS NESO,135.62,132.36,136.58,138.67,0.6532,0.6186,0.6824,0.7222,1.53
Minnesota,24,842420,SPRAY GUNS AND SIMILAR APPLIANCES,203.98,221.97,165.62,134.71,0.9826,1.0374,0.8274,0.7015,-18.67
Minnesota,25,903180,"MEAS & CHECKNG INSTRUMENT, APPLIANCES & MACH",92.57,128.21,129.24,130.48,0.4459,0.5992,0.6457,0.6795,0.96
Missouri,0,0,World,12958.22,14189.64,13647.81,13934.62,0.8209,0.8749,0.908,0.9603,2.1
Missouri,0,25,Top 25,4275.68,5288.68,5260.84,6475.05,32.9959,37.2714,38.5472,46.4673,23.08
Missouri,1,870431,"MTR VEH TRANS GDS SPK IG IN C P ENG, GVW NOV",1280.51,1450.89,1155.84,1542.94,9.8818,10.225,8.469,11.0727,33.49
Missouri,2,880000,"CIVILIAN AIRCRAFT, ENGINES, AND PARTS",86.43,495.54,685.82,1327.78,0.667,3.4923,5.0252,9.5286,93.6
Missouri,3,871150,"MOTORCYCLES, CYCL,EXCD 800 CC",254.22,267.5,237.55,335.38,1.9619,1.8852,1.7406,2.4068,41.18
Missouri,4,300230,VACCINES FOR VETRINARY MEDICINE,381.27,333.02,336.91,317.93,2.9423,2.3469,2.4686,2.2816,-5.63
Missouri,5,230400,"SOYBEAN OILCAKE & OTH SOLID RESIDUE, WH/NOT G",68.51,240.31,262.11,273.42,0.5287,1.6936,1.9205,1.9622,4.32
Missouri,6,100590,"CORN (MAIZE), OTHER THAN SEED CORN",109.88,167.81,231.98,231.74,0.848,1.1826,1.6998,1.6631,-0.1
Missouri,7,120190,"SOYBEANS, NESOI",138.18,161.34,164.37,215.13,1.0663,1.137,1.2044,1.5439,30.88
Missouri,8,410411,"BOV/EQ HIDE/SKIN,FUL GRN,UNSPLIT;GRN SPL, WET",125,198.17,204.63,173.5,0.9646,1.3966,1.4994,1.2451,-15.21
Missouri,9,210690,FOOD PREPARATIONS NESOI,179.67,198.09,173.56,165.37,1.3865,1.396,1.2717,1.1867,-4.72
